"ABILITALIKE__C","ALLEGATO_1__C","AREA__C","AUTORE__C","CONTENUTO__C","CREATEDBYID","CREATEDDATE","DATA_ORA_NOTIFICA__C","DATA_ORA_PUBBLICAZIONE__C","DOMANDA__C","GENITORE__C","ID","IMMAGINE_DI_COPERTINA__C","IMPOSTAZIONE_COMMENTI__C","IN_EVIDENZA_FINO_A__C","ISDELETED","LASTACTIVITYDATE","LASTMODIFIEDBYID","LASTMODIFIEDDATE","LASTREFERENCEDDATE","LASTVIEWEDDATE","LINK_IMMAGINE_DI_COPERTINA__C","MENU__C","NAME","OWNERID","RIASSUNTO__C","SOTTOTITOLO__C","SYSTEMMODSTAMP","TAG__C","TIPOLOGIA__C","TITOLO__C"
"true","","Marketing","a121n000002aZP1AAM","<strong>Discorso di Akio Toyoda – Tokyo Motor Show 2019</strong></br></br>

<strong>Toyoda</strong></br>
Oggi non voglio parlare di automobili ma di <strong>persone</strong>. E mi muoverò un po’ mentre parlo.</br></br>

<strong>Morizo</strong></br>
Questa volta vorrei restare nel personaggio. </br></br>

<strong>Toyoda</strong></br>
Seguendo le mie espressioni, Morizo ride e mostra sorpresa. Che ne pensate? Per esempio, anche se siamo lontani, non avete la sensazione che io sia proprio davanti a voi? </br>
Le persone processano istantaneamente grandi quantità di informazioni in questo modo e poi traggono delle conclusioni. </br>
Questo è esattamente il motivo per cui, quando diverse tipologie di informazioni sono connesse fra loro, ci aspetteremmo che le comunità, le società e, naturalmente, le automobili si focalizzino sempre di più sulle persone. Ed è per questo che questa volta abbiamo reso il nostro stand Toyota un luogo in cui le persone possano entrare in contatto con una società del futuro con una mobilità incentrata sulle persone.
Bene, credo sia arrivato il momento di dare un’occhiata. </br></br>

<strong>Toyoda</strong></br>
È previsto che questo <strong>e-Palette</strong> debutti davanti a tutti ai Giochi Olimpici e Paralimpici di Tokyo 2020. </br>
In futuro, l’e-Palette potrà essere un ufficio, un negozio, o addirittura un hotel. Potrà trasformarsi e offrire diverse tipologie di servizi e raggiungerà le persone. </br>
Questa volta il nostro stand non mostrerà il singolo veicolo “che verrà lanciato il prossimo anno”. Tutto ciò che potrete trovare qui sono forme di mobilità che connettono le persone alla società e alle comunità e offrono a queste persone servizi e modi per muoversi. </br>
Wow, che ne pensate? Non vi entusiasma vedere un futuro caratterizzato da queste forme di mobilità? Per esempio, avremo addirittura qualcosa del genere – l’<strong>e-Chargeair</strong>. </br></br>

<strong>Morizo</strong></br>
L’introduzione di forme di <strong>mobilità</strong> come queste sancirà la fine del concetto di automobili di proprietà? Io spero proprio di no.</br>
La mobilità condivisa porterà le persone ad avere forme di mobilità più personali.</br>
Bene, la risposta è proprio lì!</br></br>

<strong>Toyoda</strong></br>
Questo è l’<strong>e-RACER</strong>! </br>
Le automobili nei nostri garage saranno tutte automobili sportive, come questo e-RACER. </br>
Bene, forse può sembrare un’esagerazione, ma… voler realizzare i propri desideri, … e voler andare sempre più veloce e sempre più lontano, credo che siano desideri universali dell’uomo. </br>
La nascita dell’automobile portò 15 milioni di cavalli a essere sostituiti da macchine negli Stati Uniti.
Ma ancora oggi esistono i cavalli da corsa. </br>
La gioia di cavalcare un cavallo equivale da sola o addirittura supera quello che le automobili possono offrire. Se c’è un ostacolo, un cavallo può evitarlo. Se c’è una buca nel terreno, un cavallo può fare le sue valutazioni e saltarla. </br>
I <strong>cavalli</strong> possono comunicare con le persone e il loro cuore. Per le persone che li cavalcano, i cavalli sono insostituibili. </br>
Attraverso l’evoluzione dell’<strong>intelligenza artificiale</strong>, credo che anche le automobili possono diventare capaci di comunicare con le persone e il loro cuore. </br>
È così… credo che le automobili del futuro saranno come i cavalli. </br>
Se guardiamo alle forme di mobilità condivisa, come l’e-Palette, come a carrozze, le forme di mobilità individuale, come l’e-RACER, sarebbero gli “amati cavalli”. </br>
Direi che questo significa che la nostra futura società della mobilità sarà una società nella quale carrozze e “amati cavalli” conviveranno. </br>
E quello che le persone vogliono dagli “amati cavalli” è una comunicazione intima e la gioia di muoversi insieme. </br>
Bene, ecco un altro aiutante che offre una comunicazione intima. Credo che potremmo addirittura chiamarlo “scopa magica”. </br>
Se visitate lo stand Toyota, potete saltarci su in questo modo e provarla. Ma non è ancora pronta a volare…</br></br>

<strong>Morizo</strong></br>
Salirò sulla scopa e vi introdurrò brevemente al nostro stand. </br></br>

<strong>Toyoda</strong></br>
Grazie Morizo! </br></br>

Il nostro tema è la vita nel futuro incentrata sulle <strong>persone</strong>. Il nostro primo obiettivo è far divertire chi ci visita. Crediamo che divertirsi sia importante. La stessa sensazione si estende all’importanza che poniamo sul concetto di “<strong>DIVERTENTE DA GUIDARE</strong>”, anche quando si tratta di mobilità del futuro. </br></br>

Il mio scopo oggi era quello di aiutarvi a conoscere lo stand Toyota. Abbiamo preparato le nostre nuove automobili in un’altra location. Vi invito a dar loro un’occhiata. </br></br>

Ad ogni modo, oggi, il focus è sulle persone. La società oggi sta avanzando rapidamente verso l’automazione, nelle forme, ad esempio, dell’intelligenza artificiale e della robotica. </br>
Allo stesso tempo, emergono preoccupazioni del tipo “Come potrà non arrivare il giorno in cui i robot domineranno le persone?”. </br>
Come dovrebbe rispondere Toyota a questo cambiamento epocale? </br>
Credo che un suggerimento ci venga offerta dalla storia dei nostri predecessori. </br>
In particolare, il <strong>Toyota Production System</strong> ci offre un suggerimento. </br></br>

Le radici di Toyota si trovano nel telaio automatico inventato da <strong>Sakichi Toyoda</strong>. </br>
L’elemento più importante della sua invenzione fu che, se un singolo filo si fosse rotto, il telaio si sarebbe automaticamente fermato. </br>
Naturalmente questo aiutava a prevenire la produzione di prodotti difettosi. Ma l’idea di fondo era che non dovremmo trasformare le persone in dei semplici supervisori delle macchine. </br>
In Toyota chiamiamo questo concetto “<strong>automazione con le persone</strong>”, o “<strong>automazione intelligente</strong>”. </br>
Kiichiro Toyoda, che raccolse la sfida di produrre automobili, aggiunse a questa “automazione intelligente” il concetto di “fare solo quello che è necessario, quando è necessario e nella misura in cui è necessario”: il <strong>just in time</strong>. </br>
Questo significa essere appena sopra alle aspettative dei nostri clienti. </br></br>

Questa è l’interpretazione ultima, nell’ambito della produzione, dell’<strong>omotenashi</strong> (l’ospitalità che anticipa e soddisfa in maniera sincera e calorosa i bisogni delle persone). </br>
I due pilastri del Toyota Production System – “automazione intelligente” e “just-in-time”. </br>
Quello che questi due elementi hanno in comune è il <strong>porre le persone al centro</strong>. </br>
E questo è esattamente il motivo per cui le persone continueranno ad essere al centro del futuro che immaginiamo. </br>
Credo che con l’avanzare dell’automazione, l’abilità degli esseri umani verrà messa sempre più alla prova.
Per esempio, il calore e la gentilezza delle persone… il cuore che prova certe sensazioni…</br>
Quello che vogliamo esprimere attraverso il nostro stand è il concetto di “<strong>persone connesse</strong>”. “Persone connesse” è un concetto che fa riferimento a una società nella quale le persone sono collegate – una società nella quale si possa sentire il calore e la gentilezza delle persone. </br></br>

Le parole chiave sono “persone connesse”. </br>
Toyota crede nel “<strong>potere delle persone</strong>”.</br> 
Vi invito a guardare dove arriverà <strong>Toyota</strong>.</br>","0050Y000002b7vuQAA","2019-11-13T15:31:52.000Z","2019-11-14T12:00:00.000Z","2019-11-14T12:00:00.000Z","","","a0Y1n00000HQqfFEAT","https://docs.quintegia.it/Ricerche/TMI_RCC/RCC_Q_201911_TokyoMotorShow_AkioToyoda_1.jpg","Lettura e Scrittura","2020-04-30T21:00:00.000Z","false","","0050Y000002b7vuQAA","2020-03-25T08:06:43.000Z","","","","Toyota;Lexus","ART-00000019","0050Y000002b7vuQAA","""Oggi non voglio parlare di automobili ma di persone."" - Akio Toyoda","","2020-03-25T08:06:43.000Z","Akio Toyoda,Tokyo Motor Show","Articolo","Akio Toyoda – Tokyo Motor Show 2019"
"true","","Marketing","a121n000002aZP1AAM","<strong>Discorso di Gill Pratt – Tokyo Motor Show 2019</strong></br></br>

Buongiorno a tutti.</br></br>

Sono <strong>Gill Pratt</strong>, CEO del Research Institute e Fellow di Toyota Motor Corporation.</br>
I discorsi di James Kuffner e Koga-san che faranno seguito oggi riguarderanno, in superficie, l’applicazione dell’automazione ad automobili e robot. Ma alla base dei loro discorsi c’è un’idea forte di cui vorrei parlarvi prima – l’idea che la vita di un uomo dovrebbe avere un significato e uno scopo. </br></br>

Come molti di voi sapranno, in Giappone questa idea prende il nome di “Ikigai”. E io credo che sia un concetto che ha tanto da insegnare a chi come noi costruisce vetture automatizzate e robot. </br></br>

L’<strong>Ikigai</strong> ci insegna che noi esseri umani ci sentiamo più soddisfatti quando le nostre vite includono un lavoro, in particolare un lavoro che amiamo, nel quale siamo bravi, un lavoro che la società apprezza e, soprattutto, che aiuti la società. </br></br>

In Giappone l’aspirazione all’Ikigai è dappertutto: dall’ospitalità di un tassista con guanti bianchi, al lavoro meticoloso di un sushi chef, all’impegno degli operai e degli ingegneri Toyota nel produrre vetture sempre migliori. </br></br>

Mentre l’aspirazione all’Ikigai è visibile soprattutto in Giappone, le sue conseguenze sono universali. </br>
Nell’antica Grecia, Aristotele scriveva del valore dell’<strong>Eudaimonia</strong> – la vita virtuosa – includendo l’importanza di un contributo sociale. In Italia, l’Ikigai si rispecchia ne “<strong>La Dolce Vita</strong>”. In Francia, come mostra questo bellissimo film animato del 1934 che mette insieme balletto e lavoro di fabbrica, l’Ikigai dà vita alla “<strong>Joie de Vivre</strong>” – la Gioia di Vivere. </br></br>

Anche negli USA, dove il lavoro è spesso percepito come un obbligo, l’idea dell’Ikigai è richiamata dalla teoria del “Flow”, dal lavoro di “<strong>Me-High Chick-Sent-Me-High</strong>” (Mihaly Csikszentmihaly), che sottolinea che il massimo appagamento arriva quando lavoriamo all’intersezione della nostra massima competenza e della nostra più grande sfida. </br></br>

Quindi, come si collega lo sviluppo della <strong>guida automatizzata<strong> e della </strong>robotica</strong> all’Ikigai? </br></br>

Ora vi spiegherò il collegamento. La maggior parte delle aziende di guida automatizzata e robotica oggi sono focalizzate sull’utilizzo della tecnologia per sostituire il lavoro degli esseri umani. </br></br>

Questa è un’idea molto vecchia. Infatti, il termine “robot”, dalla parola ceca robota, vuol dire “lavoro forzato” e apparve per la prima volta in una rappresentazione teatrale ceca di grande successo del 1920, durante un’epoca in cui il fine della tecnologia era liberare gli esseri umani dal lavoro percepito come fatica. </br></br>

Ma oggi, pensiamo ancora che tutto il lavoro sia fatica e che sostituire il lavoro dei robot al lavoro dell’uomo sia una buona idea? </br></br>

Beh, talvolta la risposta è sì. Delegare ai robot alcuni lavori particolarmente noiosi, sporchi o pericolosi può essere una buona idea. </br></br>

Ma oggi, man mano che gli effetti collaterali dell’automazione cominciano a essere più evidenti, stiamo realizzando che sostituire tanti tipi di lavoro, anche quelli un po’ noiosi, sporchi o pericolosi, può essere controproducente. </br></br>

Perché? Perché senza lavoro e senza dare un contributo alla società, gli esseri umani risentono della mancanza di uno scopo. Senza lavoro e contributo sociale non può esserci Ikigai, Flow né Dolce Vita. </br></br>

In altre parole, a volte può essere piacevole lavare i piatti a mano – specialmente se lo si fa per qualcun altro – anche se lo si è fatto centinaia di volte prima. E anche se, per quanto sorprendente possa sembrare, una macchina può lavarli meglio. </br></br>

Naturalmente qualche volta il lavoro può essere faticoso. Ma una vita fatta solo di piacere senza un lavoro apprezzato da altri e a beneficio di altri, non è appagante. Qualcuno potrebbe addirittura dire che non vale la pena di essere vissuta. </br></br>

Il che ci porta all’incombente crisi di una società che invecchia. </br></br>

La triste verità è che ancora oggi il pensionamento spesso provoca più tristezza che gioia, in quanto le persone anziane possono sentirsi non solo fisicamente invalidi ma anche soli ed emotivamente senza uno scopo. </br></br>

Riusciranno i futuri veicoli automatizzati e i robot a risolvere questo problema? </br></br>

Sì, ma solo se riusciamo a cogliere gli insegnamenti dell’Ikigai nel progettare queste nuove macchine. Invece di costruire macchine unicamente per sostituire il lavoro dell’uomo, dobbiamo costruire macchine che lo amplifichino. </br></br>

Questa idea risale a qualche decennio fa. Negli anni ’50 nacque il campo dell’<strong>intelligenza artificiale</strong>: IA. Gli scienziati erano affascinati dal modo in cui riusciamo a replicare le capacità della mente umana nelle macchine; in pratica sostituendo l’intelligenza umana con quella delle macchine. </br></br>

Più o meno nello stesso periodo andava sviluppandosi un altro settore che ribaltò l’idea di intelligenza artificiale: l’<strong>Intelligenza Amplificata</strong>. L’idea dell’Intelligenza Amplificata si basava sul lavoro in sinergia di persone e macchine per ottenere insieme risultati migliori di quelli che ognuno avrebbe raggiunto da solo. </br></br>

Mentre l’Intelligenza Artificiale era incentrata sulle macchine, l’Intelligenza Amplificata era antropocentrica. Mentre l’Intelligenza Artificiale può far sì che le persone anziane si sentano più vecchie e meno utili, l’Intelligenza Amplificata può farle sentire più giovani e capaci. I robot che ci aiutano ad alzare oggetti pesanti mentre noi ci occupiamo di altri aspetti del lavoro … e le automobili che ci aiutano a evitare incidenti mentre guidiamo, costituiranno il beneficio tangibile dell’Intelligenza Amplificata. </br></br>

Vetture che ci permettano di assaporare la “gioia di guidare” … e robot che ci aiutino a lavorare e invecchiare con dignità e mantenere una connessione con la società dando il nostro genuino contributo, costituiranno il beneficio emotivo dell’Intelligenza Amplificata. </br></br>

Insieme, i legami fisici ed emotivi che verranno creati dall’Intelligenza Amplificata faranno sì che gli esseri umani sviluppino fiducia e amore per le macchine, il cui scopo è esaltare l’Ikigai, non sminuirlo. </br></br>

Permettetemi di spiegare questo concetto con un esempio del settore automobilistico. </br></br>

Oggi c’è tanta eccitazione attorno all’idea di<strong> futuristici taxi robotici e completamente automatizzati</strong>. E, senza dubbio, partendo da ambiti di progettazione operativa più ristretti, siamo vicini a sostituire gli autisti con l’Intelligenza Artificiale. </br></br>

Questa è una buona idea – se e quando una persona è impossibilitata a guidare o non vuole farlo. In futuro, veicoli completamente automatizzati come il <strong>Toyota e-Palette</strong> saranno meravigliose novità per la mobilità di persone e cose. Dovremmo anche accogliere l’opzione di un pilota parzialmente autonomo nelle vetture personali per sollevarci dal peso di tragitti noiosi e trafficati. </br></br>

Ma questo significa, come qualcuno ha suggerito, che dovremmo aspirare a rendere, un giorno, il controllo di tutti i veicoli meccanico e bandire dalle nostre strade le automobili guidate da esseri umani? Dovremmo sempre servirci dell’Intelligenza Artificiale piuttosto che dell’Intelligenza Amplificata? </br></br>

Io spero vivamente di no, perché guidare può essere uno dei grandi piaceri della vita, l’atto in cui una macchina amplifica lo sforzo dei nostri muscoli fino alla potenza di centinaia di cavalli e ci sentiamo incredibilmente vivi nel controllare la vettura. L’entusiasmo di questo motor show ne è la prova. </br></br>

E in casa, che tipo di robot dovremmo costruire? Dovremmo seguire il percorso di un robot aspirapolvere completamente automatizzato e rendere le nostre case ambienti del tutto privi di lavoro? Dopotutto, potremmo stenderci sul divano e guardare la TV tutto il giorno o diventare dipendenti dallo smartphone senza bisogno di fare alcun tipo di lavoro. </br></br>

Io spero che voi, come me, avvertiate che una casa completamente automatizzata renderebbe molti di noi inutili e che ritirarsi in una casa del genere sarebbe l’esatto opposto della ricerca dell’Ikigai. </br></br>

Possiamo fare meglio di così. Possiamo <strong>aiutare le persone ad avvicinarsi all’Ikigai per tutta la vita</strong>, anche dopo il pensionamento. Le nuove tecnologie possono rendere le automobili più sicure e più divertenti da guidare, non meno… avendo sia l’Intelligenza Artificiale che Amplificata come compagni di squadra, ci auguriamo. </br></br>

E a casa, i robot diventano nostri compagni mentre invecchiamo, non i nostri sostituti, e ci aiutano a sentirci un po’ più giovani invece che anziani. </br></br>

Non sappiamo ancora come costruire una macchina del tempo per togliere 10 anni di età, ma le capacità dei robot che ci aiutano a continuare a lavorare sono quanto di più vicino a una macchina del tempo noi sappiamo costruire. </br></br>

Prima che James e Koga-san prendano la parola, lasciate che mi congedi con questi due pensieri conclusivi. </br></br>

Il primo è che il giapponese spesso chiama le automobili “<strong>Aisha</strong>” – la mia amata automobile. Come mi fece notare una volta Akio Toyoda, per quanto ne sapesse, in giapponese non c’è una parola equivalente per un amato frigorifero. Le persone amano le loro macchine, perché sono un’espressione e un’estensione di quello che sono … e anche perché, a differenza di un frigorifero, non sono completamente automatizzate. Il <strong>piacere di guidare è un’emozione profondamente umana</strong>. </br></br>

Per concludere, l’aspirazione all’Ikigai non è casuale. L’evoluzione ha creato in tutti noi un senso di appagamento emotivo quando riusciamo a portare a termine un lavoro difficile e quando lavoriamo per aiutare qualcun altro. Questo perché nel tempo gli animali che portavano a termini lavori complessi e che aiutavano gli altri hanno avuto maggior successo di quelli che non lo facevano. </br></br>

Così, l’<strong>aspirazione all’Ikigai è nel nostro DNA</strong> e risale a milioni se non miliardi di anni fa. L’Ikigai non è solo una parola esoterica giapponese che occidentali alla moda usano per fare colpo sui loro amici a un cocktail party, anche se lo faranno. </br></br>

Piuttosto l’Ikigai è un’idea forte che riguarda il modo che il Giappone ha fatto suo, forse più entusiasticamente degli altri Paesi, di realizzare appagamento nell’uomo. </br></br>

Nel 1964, durante gli ultimi Giochi Olimpici di Tokyo, il Giappone stupì il mondo con l’introduzione di entrambi i <strong>treni ad alta velocità Shinkansen</strong> e il lancio del suo <strong>sistema nazionale di superautostrade</strong>. Insieme, le due cose hanno segnato l’inizio di uno straordinario boom dello sviluppo tecnologico in <strong>Giappone</strong> e il suo impegno per il concetto di <strong>mobility for all</strong>. </br></br>

Il prossimo anno accoglieremo un’altra volta il mondo alle <strong>Olimpiadi di Tokyo</strong>. E ancora una volta ci sarà grande sfoggio di nuove tecnologie, incluse quelle Toyota. </br>
Ma io credo che quello di cui il mondo ha più bisogno al momento, ancor più della tecnologia, è un altro elemento <strong>made in Japan</strong> – una filosofia sul modo di utilizzare la tecnologia per dare un significato alla vita nell’<strong>era dell’automazione meccanica e intellettuale</strong>: la <strong>filosofia dell’Ikigai</strong>. Spero che siate d’accordo con me. </br>","0050Y000002b7vuQAA","2019-11-13T15:38:14.000Z","2019-11-14T13:00:00.000Z","2019-11-14T13:00:00.000Z","","","a0Y1n00000HQqhVEAT","https://docs.quintegia.it/Ricerche/TMI_RCC/RCC_Q_201911_TokyoMotorShow_Gill Pratt.jpg","Lettura e Scrittura","2020-04-30T21:00:00.000Z","false","","0050Y000002b7vuQAA","2020-03-25T08:07:14.000Z","","","","Toyota;Lexus","ART-00000020","0050Y000002b7vuQAA","L’Ikigai ci insegna che noi esseri umani ci sentiamo più soddisfatti quando le nostre vite includono un lavoro, in particolare un lavoro che amiamo, nel quale siamo bravi, un lavoro che la società apprezza e, soprattutto, che aiuti la società.","","2020-03-25T08:07:14.000Z","Gill Pratt,Tokyo Motor Show,Ikigai","Articolo","Gill Pratt – Tokyo Motor Show 2019"
"true","","Marketing","a121n000002aZP0AAM","""<strong>Sotto la bandiera Olimpica e Paralimpica vogliamo riaffermare il potere dello sport di unire le persone</strong>."" - <u>AKIO TOYODA Presidente di Toyota Motor Corporation</u><br><br><strong>L&rsquo;impegno di Toyota</strong>: siamo totalmente impegnati a sprigionare il massimo potenziale umano attraverso la forza del movimento, questo &egrave; il motivo per cui siamo orgogliosi Partner dei Giochi Olimpici e Paralimpici.<br><br>I Giochi sono la pi&ugrave; grande celebrazione esistente del movimento umano. &Egrave; durante i Giochi che impariamo il vero potere dello sport: lo sport ci sfida, ci ispira e, soprattutto, ci unisce. E in qualit&agrave; di Partner Mondiale per la Mobilit&agrave; dei Giochi Olimpici e Paralimpici, condividiamo l'obiettivo di ispirare le persone a spingersi in avanti, oltre la linea d&rsquo;arrivo, oltre ci&ograve; che ritengono impossibile.<br><br>Nell&rsquo;impegno di portare la promessa delle discipline sportive in ogni angolo del mondo, stiamo lavorando con il CIO (Comitato Olimpico Internazionale) e il CPI (Comitato Paralimpico Internazionale) per aiutare gli aspiranti olimpionici e paralimpionici a realizzare il loro sogno, indipendentemente dalle circostanze.<br><br><img src=""https://docs.quintegia.it/Ricerche/TMI_RCC/RCC_Q_201909_Olimpiadi_IspiriamoilMondoaMuoversi_imgInterna_2.jpg""/>","0050Y000000NtQOQA0","2019-08-28T14:35:55.000Z","2019-06-04T08:00:00.000Z","2019-06-04T08:00:00.000Z","","","a0Y1n00000HdITYEA3","https://docs.quintegia.it/Ricerche/TMI_RCC/RCC_Q_201909_Olimpiadi_IspiriamoilMondoaMuoversi_imgCover.jpg","Lettura e Scrittura","2019-12-31T11:00:00.000Z","false","","0050Y000001Te0YQAS","2019-11-20T16:23:46.000Z","","","","Toyota;Lexus","ART-00000002","0050Y000000NtQOQA0","<strong>L&rsquo;impegno di Toyota</strong>: siamo totalmente impegnati a sprigionare il massimo potenziale umano attraverso la forza del movimento.","","2019-11-20T16:23:46.000Z","olimpiadi,paralimpiadi,partner,impegno","Articolo","Ispiriamo il mondo a muoversi"
"true","","Marketing","a121n000002aZP0AAM","""<strong>Pensavamo fosse impossibile perch&eacute; abbiamo iniziato tardi, a 24 anni, ma l&rsquo;et&agrave; non conta. Anche se non si &egrave; pi&ugrave; cos&igrave; giovani, si pu&ograve; sempre partecipare alle Olimpiadi, come abbiamo fatto noi.</strong>"" - <u>LIINA LUIK</u><br><br>La corsa &egrave; entrata a far parte della vita delle sorelle Luik quando avevano gi&agrave; 24 anni. Liina &egrave; stata la prima a scegliere questo sport, incoraggiando poi le sorelle a fare lo stesso. &Egrave; stata una scelta naturale per le sorelle perch&eacute;, come dice Liina, &ldquo;il movimento per noi &egrave; sinonimo di libert&agrave;&rdquo;. Un sano spirito di competizione tra sorelle le ha portate a prefissarsi l&rsquo;obiettivo impossibile e condiviso di correre l&rsquo;una contro l&rsquo;altra, e l&rsquo;una affianco all&rsquo;altra, ai Giochi olimpici.<br><br>Dopo mesi di allenamento senza sosta, le sorelle Luik si sono qualificate alle Olimpiadi di Rio 2016 diventando il primo e unico caso di tre gemelle a prendere parte ai giochi. Dopo la gara, esauste ma colme di gioia, Lily, Liina e Leila si sono abbracciate, orgogliose di aver esaudito il sogno comune di correre insieme come atlete olimpiche.<br><br>&ldquo;Anche se non si &egrave; pi&ugrave; cos&igrave; giovani, si pu&ograve; sempre partecipare alle Olimpiadi, come abbiamo fatto noi&rdquo;, ha dichiarato Liina Luik.","0050Y000000NtQOQA0","2019-08-28T14:35:55.000Z","2019-06-20T08:00:00.000Z","2019-06-20T08:00:00.000Z","","","a0Y1n00000HdITZEA3","https://docs.quintegia.it/Ricerche/TMI_RCC/RCC_Q_201909_Olimpiadi_RaggiungereLImpossibile_imgCover.jpg","Lettura e Scrittura","2019-12-31T11:00:00.000Z","false","","0050Y000001Te0YQAS","2019-11-20T16:23:59.000Z","","","","Toyota;Lexus","ART-00000003","0050Y000000NtQOQA0","<strong>Raggiungere l’impossibile:</strong> questa storia appassionante ci dimostra cosa diventa possibile quando ci spingiamo oltre i limiti della mobilità umana.","","2019-11-20T16:23:59.000Z","olimpiadi,storieimpossibili","Articolo","Le nostre storie impossibili"
