"ABILITALIKE__C","ALLEGATO_1__C","AREA__C","AUTORE__C","CONTENUTO__C","CREATEDBYID","CREATEDDATE","DATA_ORA_NOTIFICA__C","DATA_ORA_PUBBLICAZIONE__C","DOMANDA__C","GENITORE__C","ID","IMMAGINE_DI_COPERTINA__C","IMPOSTAZIONE_COMMENTI__C","IN_EVIDENZA_FINO_A__C","ISDELETED","LASTACTIVITYDATE","LASTMODIFIEDBYID","LASTMODIFIEDDATE","LASTREFERENCEDDATE","LASTVIEWEDDATE","LINK_IMMAGINE_DI_COPERTINA__C","MENU__C","NAME","OWNERID","RIASSUNTO__C","SOTTOTITOLO__C","SYSTEMMODSTAMP","TAG__C","TIPOLOGIA__C","TITOLO__C"
"true","","Marketing","a121n000002aZP1AAM","<p><strong>Consegnati al Comitato Olimpico Nazionale Italiano i nuovi Toyota C-HR Hybrid.</strong></p>
<ul>
<li><p>Toyota, Partner per la Mobilità dei Comitati Internazionali Olimpico e Paralimpico, ha consegnato al CONI una flotta di C-HR Hybrid</p></li>
<li><p>Dotate del nuovo motore Hybrid Dynamic Force® da 184 CV, le vetture offrono una guida dinamica, reattiva ed incredibilmente piacevole con consumi ridotti ed emissioni tra le più basse della categoria</p></li>
<li><p>La tecnologia Full Hybrid Electric del Gruppo Toyota è stata introdotta per la prima volta nel 1997 e, con 15 milioni di vetture ibride vendute nel mondo, oggi Toyota è il leader mondiale nella progressiva elettrificazione dei sistemi di trazione</p></li>
</ul>
<p>Martedì 18 febbraio, nella scenografica cornice della sede del CONI al Foro Italico, sono state consegnate le nuove vetture ufficiali Toyota C-HR; alla cerimonia di consegna erano presenti <strong>Mauro Caruccio, Amministratore Delegato di Toyota Motor Italia</strong>, e <strong>Giovanni Malagò, Presidente del CONI</strong>. La partnership tra Toyota e CONI ha visto la realizzazione di un ulteriore passo nel percorso condiviso verso una società sempre più sostenibile, responsabile e inclusiva.</p>
<p><em>“Sono grato all’Amministratore Delegato Mauro Caruccio e alla Toyota Motor Italia per l’importanza attribuita alla partnership con il CONI, all’insegna della condivisione dei valori che caratterizzano lo sport”</em> afferma il Presidente del CONI, Giovanni Malagò<em>. “Si tratta di una collaborazione che assume una valenza speciale nell’anno dei Giochi Olimpici Estivi che si disputeranno a Tokyo, dove la Toyota ha costruito la leadership nel proprio settore, rappresentando l’emblema dell’industria automobilistica. È l’azienda del futuro per gli investimenti legati alla tecnologia e a una mobilità avveniristica e vincente, per questo siamo orgogliosi che abbia deciso di promuovere la propria immagine legandola al nostro movimento, come certifica la collaborazione a livello mondiale con il Comitato Olimpico Internazionale, che a sua volta ha dato fiducia al Paese e al nostro Comitato Olimpico, assegnandoci i Giochi Olimpici e Paralimpici di Milano Cortina 2026. È un cerchio magico pieno di coincidenze. Siamo felici di viaggiare insieme verso nuovi traguardi”.</em></p>

<p>La flotta delle vetture consegnate è composta interamente dai <strong>nuovi Toyota C-HR</strong>. Il nuovo C-HR, a pochi mesi dal lancio ufficiale, ha già confermato il suo straordinario appeal tra i clienti desiderosi di un crossover compatto pensato per la mobilità urbana, capace di prestazioni superiori e una guida fluida e silenziosa.</p>
<p><em>“Siamo onorati della partnership con il CONI, che ci vede impegnati nel fornire soluzioni di mobilità dotate dei sistemi tecnologici elettrificati più avanzati.&nbsp;Gli atleti del Toyota Team che, insieme ad altri,&nbsp;rappresenteranno l’Italia ai prossimi Giochi Olimpici di Tokyo si sposteranno a bordo delle nostre vetture Full Hybrid e questo ci riempie di grande orgoglio -</em> dichiara Mauro Caruccio, Amministratore Delegato di Toyota Motor Italia<em>. Il Full Hybrid Electric di Toyota e Lexus rappresenta la tecnologia più efficace per contenere consumi ed emissioni, garantendo, allo stesso tempo, facilità di utilizzo e piacere di guida. Una soluzione sempre più apprezzata ed economicamente accessibile, come dimostrato dai 15 milioni di clienti nel mondo - di cui oltre 300.000 in Italia - che nel corso degli ultimi 22 anni l’hanno scelta per le loro esigenze di mobilità”.</em></p>
<p><a href=""https://newsroom.toyota.it/c-hr-e-la-vettura-ufficiale-dellitalia-team/"">newsroom.toyota.it/c-hr-e-la-vettura-ufficiale-dellitalia-team/</a></p>","0050Y000002b7vuQAA","2020-02-21T14:51:03.000Z","2020-02-18T15:00:00.000Z","2020-02-18T15:00:00.000Z","","","a0Y1n00000Id9XHEAZ","https://docs.quintegia.it/Ricerche/TMI_RCC/RCC_Q_202002_CHR_ComitatoOlimpicoNazionale.jpg","Lettura e Scrittura","2020-04-30T21:00:00.000Z","false","","0050Y000002b7vuQAA","2020-03-25T07:55:30.000Z","","","","Toyota;Lexus","ART-00000031","0050Y000002b7vuQAA","Consegnati al Comitato Olimpico Nazionale Italiano i nuovi Toyota C-HR Hybrid","","2020-03-25T07:55:30.000Z","C-HR,VetturaUfficiale,TeamItalia,ComitatoOlimpicoNazionale","Articolo","C-HR è la vettura ufficiale dell’Italia team"
"true","","Marketing;Sales","a121n000002aZP1AAM","<p>Sono oltre <strong>15 MILIONI</strong> i Clienti, le Famiglie e le Aziende che negli <strong>ultimi 22 anni</strong> hanno scelto la tecnologia elettrificata di Toyota e Lexus in tutto il mondo.</p>
<p>Di questi, ben <strong>300.000</strong> hanno abbracciato la soluzione Full Hybrid Electric in Italia, scegliendo di diventare protagonisti di una mobilità a basse emissioni, più sostenibile e responsabile. Una Comunità capace di guardare sempre avanti che contribuisce, ogni giorno, al miglioramento della qualità dell’aria delle nostre città.</p>
<p><strong>A CIASCUNO di LORO VA il PROFONDO RINGRAZIAMENTO DEL GRUPPO TOYOTA</strong></p>
<p>“<em>Con più di <strong>20 anni di esperienza</strong> e <strong>15 milioni</strong> di veicoli elettrificati venduti nel mondo in più di <strong>90 paesi,</strong> abbiamo il <strong>know-how ingegneristico</strong>, la <strong>competenza industriale</strong> e, soprattutto, un patrimonio unico rappresentato dalla <strong>voce di Milioni di Clienti</strong> che ci aiutano, con i loro suggerimenti, a realizzare soluzioni tecnologiche sempre più avanzate</em> - dichiara <strong>Mauro Caruccio</strong>, Amministratore Delegato di Toyota Motor Italia - <em>E’ a loro che va oggi il <strong>nostro ringraziamento</strong>, perché senza la loro fiducia non si sarebbe potuta realizzare questa <strong>rivoluzione</strong> verso la progressiva elettrificazione dei sistemi di trazione, a <strong>vantaggio di ognuno di noi e delle generazioni future</strong>”.</em></p>
<p><a href=""https://newsroom.toyota.it/il-gruppo-toyota-dice-grazie-ai-15-milioni-di-clienti-nel-mondo-e-ai-300000-in-italia-che-hanno-scelto-la-tecnologia-elettrificata-di-toyota-e-lexus/"">https://newsroom.toyota.it/il-gruppo-toyota-dice-grazie-ai-15-milioni-di-clienti-nel-mondo-e-ai-300000-in-italia-che-hanno-scelto-la-tecnologia-elettrificata-di-toyota-e-lexus/</a></p>","0050Y000002b7vuQAA","2020-02-21T16:35:33.000Z","2020-02-12T17:00:00.000Z","2020-02-12T17:00:00.000Z","","","a0Y1n00000Id9xhEAB","https://docs.quintegia.it/Ricerche/TMI_RCC/RCC_Q_202002_15milioniClienti.jpg","Lettura e Scrittura","2020-06-30T21:00:00.000Z","false","","0050Y000002b7vuQAA","2020-03-25T07:54:05.000Z","","","","Toyota;Lexus","ART-00000032","0050Y000002b7vuQAA","Sono oltre 15 MILIONI i Clienti, le Famiglie e le Aziende che negli ultimi 22 anni hanno scelto la tecnologia elettrificata di Toyota e Lexus in tutto il mondo.","","2020-03-25T07:54:05.000Z","clienti,15milioni-Mondo,300mila-IT","Articolo","Il Gruppo Toyota dice grazie ai 15 milioni di clienti nel mondo"
"true","","Sales","a121n000002aZP1AAM","<p>I <strong>Top50 Dealer in Italia</strong> oggi rappresentano una quota superiore al 25% del mercato nazionale del nuovo ma le dinamiche di acquisizione registrate nel 2019 li proiettano verso una share ancor più elevata per il 2020. Questo è il risultato di importanti operazioni realizzate nel corso dell’ultimo biennio che evidenziano una forte tendenza verso la concentrazione imprenditoriale.</p>
<p>Dall’analisi condotta da Quintegia sugli ultimi bilanci depositati (del 2019, relativi al fatturato 2018) emerge che il fatturato medio di un <strong>Top50 Dealer</strong> è pari a <strong>310 milioni</strong>. Nell’arco di 10 anni tale livello medio si è innalzato di oltre il 50% rispetto ai 200 milioni del 2008, in rapporto ad una quota di mercato del 18%. Si tenga presente che, focalizzando l’attenzione solo sui <strong>primi 10 Gruppi</strong>, il fatturato medio 2018 era pari a <strong>oltre 600 milioni</strong> ed è addirittura quasi raddoppiato nell’ultimo decennio (360 milioni in media nel 2008).</p>
<p>Ma quali sono le più importanti operazioni che hanno interessato i primi 20 Gruppi in Italia? Attraverso l’attività di monitoraggio delle Reti condotta da Quintegia emergono queste <strong>10 principali acquisizioni</strong>, registrate <strong>negli ultimi 18 mesi</strong>, che han profondamente cambiato equilibri e geometrie di territorio:</p>
<ul>
<li><strong>Porsche Holding</strong>, attraverso la controllata Eurocar, ha acquisito fra 2018 e 2019 ben 5 concessionarie con marchi del <em>Gruppo VW</em> – Vicentini, Bonaldi (2018), Dorigoni, Saottini, Iob Silvano (2019) in Veneto Lombardia Trentino Friuli-Venezia-Giulia assumendo, se così si può dire, un controllo diretto in Italia. </li>
<li>La nota fusione per incorporazione di <strong>Autotorino</strong> con Autostar. Quest’ultima, di base in Friuli-Venezia-Giulia con i marchi <em>BMW-Mercedes</em>, si era espansa in Veneto anche con l’acquisizione di Motorsport. Nel 2019 Autotorino ha realizzato un fatturato di oltre 1,2 miliardi. </li>
<li><strong>Penske</strong> è il gruppo internazionale entrato in Italia tramite la joint venture Vanti-Mantellini. Ha un focus prevalente sui brand premium (BMW-Mini in primis, oltre a JLR, Volvo, Audi, Porsche) e con l’acquisizione di StarEmilia ha aggiunto al suo portafoglio marchi in Italia anche <em>Mercedes-Smart</em>.</li>
<li><strong>Bossoni</strong>: tra fine 2018 e inizio 2019 ha acquisito la concessionaria Lodigiani <em>Audi-VW</em>, aggiunto il mandato <em>Peugeot</em> da Liberini e, in ultima, rilevato Agricar Mercedes dopo fallimento. </li>
<li><strong>Brandini</strong> ha ampliato portafoglio marchi verso brand premium acquisendo Autoeur (<em>BMW</em>).</li>
<li>Fra i Gruppi <strong>biAuto</strong> e <strong>Biasotti</strong> è nata una NewCo, in Piemonte e Liguria, con focus su <em>brand premium</em> (BMW, Mercedes, JLR, VW). </li>
<li>Il Gruppo <strong>De Bona</strong> ha acquisito Nuova Fergia (<em>FCA, Peugeot, Hyundai</em>).</li>
<li>Il Gruppo <strong>Gest-Auto</strong> ha acquisito Ardena in Lombardia (<em>Mercedes</em>).</li>
<li>Il Gruppo <strong>Sina</strong> ha acquisito Peressini (<em>VW Skoda</em>).</li>
<li><strong>Fassina</strong> ha acquisito Muzzatti (<em>Audi Skoda</em>).</li>
</ul>
<p>È evidente come le dinamiche di espansione siano piuttosto marcate nel Nord Italia. Considerando queste acquisizioni ed altre minori, i Top 50 in termini di copertura territoriale sono arrivati a rappresentare circa il <strong>17% dei punti vendita generalisti</strong> e addirittura il <strong>41% dei marchi specialisti</strong>.</p>","0050Y000002b7vuQAA","2020-02-26T10:02:30.000Z","2020-02-28T09:30:00.000Z","2020-02-28T09:30:00.000Z","","","a0Y1n00000Idc9JEAR","https://docs.quintegia.it/Ricerche/TMI_RCC/RCC_Q_202002_TopDealer.jpg","Lettura e Scrittura","2020-06-30T21:00:00.000Z","false","","0050Y000002b7vuQAA","2020-03-25T07:53:44.000Z","","","","Toyota;Lexus","ART-00000033","0050Y000002b7vuQAA","Quali sono le più importanti operazioni che hanno interessato i Top Dealer in Italia? Attraverso l’attività di monitoraggio condotta da Quintegia emergono 10 principali acquisizioni, registrate negli ultimi 18 mesi, che han profondamente cambiato equilibri e geometrie di territorio.","","2020-03-25T07:53:44.000Z","TopDealer,ultimi18mesi,acquisizioni","Articolo","Top Dealer in Italia: le 10 principali acquisizioni degli ultimi 18 mesi"
"true","","Sales","a121n000002aZP1AAM","<p>Per contribuire alla riduzione di emissioni di CO<sub>2</sub> in atmosfera e promuovere la mobilità sostenibile, Safilo ha avviato il rinnovo del proprio parco autovetture aziendale a favore di veicoli ibridi di Toyota e Lexus.</p>
<p>L’ingresso delle prime auto con tecnologia <em>Full Hybrid</em> si inserisce nel contesto di un più articolato programma di riconversione totale del parco veicoli di Safilo in un’ottica di mobilità sostenibile: già nel corso del 2020 l’Azienda prevede l’inserimento di circa 100 nuove auto dotate della più avanzata tecnologia <em>Full Hybrid</em> del Gruppo Toyota, per poi progressivamente sostituire il resto della flotta in Italia e all’estero.</p>
<p>La tecnologia Full Hybrid Electric del Gruppo Toyota consente non soltanto di ridurre i consumi e le emissioni di gas climalteranti (CO<sub>2</sub>, fino a circa il 30% in meno rispetto a motorizzazioni di tipo convenzionale <sup>(1)</sup>) e nocivi per la salute umana come gli NOx (le emissioni di ossidi di azoto prodotte dalle automobili Toyota e Lexus Full Hybrid sono inferiori di oltre il 90% rispetto ai limiti omologativi previsti dalla legge), ma garantisce il migliore compromesso possibile tra efficienza del motore, emissioni e prestazioni. Tutto ciò senza alcun cambiamento delle abitudini di guida e senza necessità di una ricarica esterna.</p>
<p>“Innovazione e ricerca costante dell’eccellenza fanno parte da sempre del DNA di Safilo e sono oggi le qualità che ci sostengono nel compiere scelte responsabili di fronte alla necessità inderogabile di ridurre l’impatto ambientale tanto a livello individuale quanto aziendale”, ha commentato <strong>Angelo Trocchia, CEO di Safilo Group</strong>. “Per questo motivo, ci siamo affidati a un <em>partner</em> come Toyota che rappresenta l’eccellenza mondiale nello sviluppo di autovetture a tecnologia ibrida per avvicinarci ulteriormente agli obiettivi di riduzione delle emissioni di gas serra. Abbiamo già ottenuto progressi tangibili su fronti quali l’efficientamento dei consumi idrici ed energetici nei nostri siti produttivi, e siamo più che mai determinati a fare molta altra strada ancora nel segno della sostenibilità”.</p>
<p>“Siamo molto orgogliosi che Safilo, in tema di mobilità, abbia scelto la nostra tecnologia Full Hybrid Electric nel suo percorso di riduzione dell’impatto ambientale”, ha dichiarato <strong>Mauro Caruccio, Amministratore Delegato di Toyota Motor Italia</strong>. “Il <em>Full Hybrid Electric</em> che equipaggia le vetture Toyota e Lexus è oggi la soluzione più immediata per la realizzazione di una mobilità sostenibile e accessibile a tutti, come dimostrato dai 15 milioni di clienti nel mondo che ci hanno dato fiducia. La <em>partnership</em> con Safilo si fonda sulla condivisione degli stessi valori: innovazione e attenzione alle tematiche ambientali.”</p>

<p>La svolta sostenibile della mobilità in Safilo rientra all’interno di un piano di efficientamento energetico e di progressiva riduzione dell’impronta ecologica di tutte le attività dell’Azienda, che ha come obiettivo minori emissioni di CO<sub>2</sub>, una riduzione dei consumi inquinanti e quindi anche una maggior tutela dell’ambiente e della salute. Temi che sono da sempre al centro dei programmi di responsabilità sociale di Safilo che pone al centro delle proprie politiche la sostenibilità, intesa non solo come salvaguardia delle risorse ambientali ma anche come garanzia di crescita sociale ed economica nel lungo termine.</p>

<p><a href=""https://newsroom.toyota.it/safilo-e-toyota-nel-segno-della-mobilita-sostenibile/"">https://newsroom.toyota.it/safilo-e-toyota-nel-segno-della-mobilita-sostenibile/</a></p>","0050Y000002b7vuQAA","2020-03-02T13:03:04.000Z","2020-03-02T13:30:00.000Z","2020-03-02T13:30:00.000Z","","","a0Y1n00000Ie5s7EAB","https://docs.quintegia.it/Ricerche/TMI_RCC/RCC_Q_202003_Safilo.jpg","Lettura e Scrittura","2020-09-30T21:00:00.000Z","false","","0050Y000002b7vuQAA","2020-06-29T13:54:15.000Z","","","","Toyota;Lexus","ART-00000034","0050Y000002b7vuQAA","Nel corso del 2020 Safilo prevede l’inserimento di 100 vetture Full Hybrid Electric del Gruppo Toyota, per promuovere la mobilità a basse emissioni e ad alta efficienza energetica. Il piano di riconversione del parco auto per Safilo rientra in un piano più ampio di efficientamento energetico e di progressiva riduzione dell’impronta ecologica di tutte le attività dell’Azienda.","","2020-06-29T13:54:15.000Z","Safilo,MobilitàSostenibile","Articolo","Safilo e Toyota nel segno della mobilità sostenibile"
"true","","Marketing","a121n000002aZP1AAM","<ul>
<li style=""text-align: justify;""><em>Al via il progetto di Lexus, brand premium del gruppo Toyota, che attraverso un fund raising finanzierà un fondo a sostegno degli interpreti dello spettacolo, settore particolarmente colpito dalle conseguenze della pandemia, e in particolare per dare supporto e garanzie alle donne nel periodo della gravidanza.</em></li>
<li style=""text-align: justify;""><em>La garanzia di far vivere esperienze uniche, di suscitare emozioni sempre nuove, di scatenare passioni, sono solo alcuni dei valori che uniscono il mondo del cinema e Lexus</em> <em>e sono alla base anche del progetto “Poltrone Rosse”, che vede la partecipazione attiva anche di UNITA, l’Unione Nazionale Interpreti Teatro e Audiovisivo</em></li>
<li style=""text-align: justify;""><em>Un evento itinerante che vedrà ricreata nelle piazze di 5 città italiane (Milano, Torino, Venezia, Napoli, Roma) una fila di Poltrone Rosse come al cinema dove si alterneranno volti noti, interpreti e appassionati per raccontare il loro legame con il mondo del cinema. Per sedersi sulle poltrone sarà necessario acquistare un biglietto il cui incasso sarà devoluto ad un fondo presso UNITA.</em></li>
</ul>
<p style=""text-align: justify;"">Il forte legame di Lexus con il mondo del cinema si rinforza ulteriormente con il progetto “Poltrone Rosse”, promosso insieme ad UNITA-Unione Nazionale Interpreti Teatro e Audiovisivo, per creare un fondo a sostegno degli interpreti dello spettacolo, settore particolarmente colpito dalle restrizioni e limitazioni legate all’emergenza sanitaria.</p>
<p style=""text-align: justify;"">Il fondo darà supporto in particolare alle donne in gravidanza, per dare garanzie e tutele alle interpreti durante questo delicato periodo della vita.</p>
<p style=""text-align: justify;"">Poltrone Rosse è un <strong>evento itinerante che vedrà ricreata nelle piazze di 5 città italiane una fila di poltrone</strong> come al cinema dove attori, volti noti ma anche semplici appassionati potranno sedersi per raccontare la propria passione per il grande schermo, aneddoti e curiosità che possano simboleggiare il ruolo e l’importanza del cinema nella vita e nella crescita di ogni persona. Come in tutti i cinema, per sedersi sulle “Poltrone Rosse” occorre <strong>acquistare un biglietto, il cui incasso andrà a sostenere il fondo istituito presso UNITA a favore delle interpreti durante il periodo della gravidanza.</strong></p>
<p style=""text-align: justify;"">“<em>Poltrone Rosse è una delle dimostrazioni più concrete di quanto Lexus voglia essere vicino al mondo dello spettacolo, intervenendo direttamente a sostegno degli interpreti e in particolare delle interpreti in un momento bellissimo ma allo stesso tempo complesso della loro vita</em>” ha dichiarato <strong>Maurizio Perinetti, Direttore Lexus Italia</strong>. “<em>Nella nostra visione ogni individuo deve avere la possibilità di esprimere al meglio i propri talenti, verso una società sempre più inclusiva e attenta ai bisogni delle persone. Lo facciamo attraverso Poltrone Rosse, lo abbiamo fatto con altre iniziative a sostegno dell’empowerment femminile e contro ogni discriminazione, ma soprattutto lo facciamo ogni giorno nelle nostre attività quotidiane, perché è un impegno profondo che nasce dai valori di Lexus e del Gruppo Toyota in generale</em>”.</p>
<p style=""text-align: justify;"">La garanzia di far <strong>vivere esperienze uniche</strong>, di suscitare <strong>emozioni sempre nuove</strong>, di <strong>scatenare passioni</strong>, sono infatti solo alcuni dei valori che <strong>uniscono il mondo del cinema e Lexus</strong>. Che sia un film d’autore o un’auto Lexus, la <strong>maestria artigianale</strong> nel realizzare l’opera, la <strong>massima</strong> <strong>cura di ogni dettaglio</strong> e soprattutto l’attenzione posta alla <strong>centralità della persona</strong> sono gli ingredienti essenziali per riuscire a trasmettere emozioni autentiche, uniche, memorabili.</p>
<p style=""text-align: justify;"">Da qui la chiamata all’azione di Lexus, per riaccendere le emozioni che il cinema riesce a regalare insieme a tutti coloro che hanno a cuore la <em>settima arte</em> e gli interpreti che la animano.</p>
<p style=""text-align: justify;"">Dopo la prima tappa del 22-25 luglio a Milano, Poltrone Rosse sarà in scena dal 31 luglio-1° agosto a Torino per poi sbarcare al lido durante i giorni della Biennale Cinema 2021. Il tour proseguirà con Napoli (18-19 settembre) per poi concludersi a Roma ad ottobre in occasione della Festa del Cinema.</p>
<p><a href=""https://newsroom.lexus.it/poltrone-rosse--il-progetto-di-lexus-e-unita--a-sostegno-degli-interpreti-del-settore-dello-spettacolo/"">https://newsroom.lexus.it/poltrone-rosse--il-progetto-di-lexus-e-unita--a-sostegno-degli-interpreti-del-settore-dello-spettacolo/</p>","0050Y000002b7vuQAA","2021-07-29T08:55:00.000Z","2021-07-28T14:00:00.000Z","2021-07-28T14:00:00.000Z","","","a0Y1n00000K79YwEAJ","https://docs.quintegia.it/Ricerche/TMI_RCC/RCC_Q_202107_PoltroneRosse.jpg","Lettura e Scrittura","2021-12-31T22:00:00.000Z","false","","0050Y000002b7vuQAA","2021-10-05T10:02:01.000Z","","","","Lexus","ART-00000149","0050Y000002b7vuQAA","Il forte legame di Lexus con il mondo del cinema si rinforza ulteriormente con il progetto “Poltrone Rosse”, promosso insieme ad UNITA-Unione Nazionale Interpreti Teatro e Audiovisivo, per creare un fondo a sostegno degli interpreti dello spettacolo","","2021-10-05T10:02:01.000Z","PoltroneRosse,Teatro,Sostegno","Articolo","“Poltrone Rosse”: il progetto di Lexus e Unita-Unione Nazionale Interpreti Teatro e Audiovisivo, a sostegno degli interpreti del settore dello spettacolo"
"true","","Marketing;Sales","a121n000002aZP1AAM","<ul><li style=""text-align:justify""><strong>La produzione in Europa è iniziata nel 1971 presso lo stabilimento Ovar in Portogallo</strong></li><li style=""text-align:justify""><strong>Oggi Toyota ha nove stabilimenti europei con circa 800 mila auto prodotte ogni anno</strong></li><li style=""text-align:justify""><strong>La produzione europea ha superato attualmente i 13 milioni di veicoli</strong></li></ul><p style=""text-align:justify"">50 anni fa, Toyota ha iniziato la sua storia di successo in Europa con l'avvio di un impianto di assemblaggio di veicoli, su piccola scala, in Portogallo. Nel 1971 Toyota fondò, con Salvador Caetano, il suo primo sito produttivo in Europa, attualmente noto come lo stabilimento di Ovar.</p>
<p><a href=""https://newsroom.toyota.it/toyota-festeggia-50-anni-di-produzione-europea/"">https://newsroom.toyota.it/toyota-festeggia-50-anni-di-produzione-europea/</p>","0050Y000002b7vuQAA","2021-10-13T13:35:07.000Z","2021-10-13T13:00:00.000Z","2021-10-13T13:00:00.000Z","","","a0Y1n00000KEcLfEAL","https://docs.quintegia.it/Ricerche/TMI_RCC/RCC_Q_202110_50anniProduzioneEU.jpg","Lettura e Scrittura","2022-06-30T21:00:00.000Z","false","","0050Y000002b7vuQAA","2022-01-08T14:18:52.000Z","","","","Toyota;Lexus","ART-00000152","0050Y000002b7vuQAA","50 anni fa, Toyota ha iniziato la sua storia di successo in Europa con l'avvio di un impianto di assemblaggio di veicoli, su piccola scala, in Portogallo.","","2022-01-08T14:18:52.000Z","Produzione,EU,50anni","Articolo","Toyota festeggia 50 anni di produzione europea"
